{
  "schema_version": "1.1",
  "activity_id": "act_mock_5v5_u15",
  "pipeline_version": "mock-1.1.0",
  "generated_at": "2026-10-21T20:00:00+08:00",
  "params": {
    "format": "5V5",
    "age_group": "U15",
    "court_type": "FULL",
    "three_point_radius_m": 6.75,
    "three_point_geometry": "ARC_AND_CORNERS",
    "corner_lateral_m": 6.6,
    "corner_junction_x_m": 1.4151,
    "period_count": 4,
    "period_minutes": 8.0,
    "shot_clock_s": 24,
    "inside_arc_points": 2,
    "outside_arc_points": 3,
    "fast_break_enabled": true,
    "formation_points": 5,
    "court_length_m": 28.0,
    "court_width_m": 15.0,
    "baseline_to_hoop_m": 1.575,
    "x_range_m": [
      -1.575,
      26.425
    ],
    "y_half_m": 7.5
  },
  "video": {
    "key": "videos/mock/5v5.mp4",
    "duration_s": 1920.0,
    "fps": 25,
    "resolution": [
      1920,
      1080
    ],
    "source": "ALBUM"
  },
  "calibration": {
    "ok": true,
    "reproj_error_px": 2.4,
    "homography": [
      12.4,
      0.8,
      -1820.5,
      -0.3,
      11.9,
      -640.2,
      0.0008,
      0.0011,
      1
    ],
    "note": "示例数据：标定为模拟值"
  },
  "events": [
    {
      "id": "e01",
      "kind": "SHOT",
      "timestamp_s": 42.5,
      "period": 1,
      "in_bounds": true,
      "confidence": 0.9,
      "clip_key": "clips/e01.mp4",
      "clip_start_s": 37.5,
      "clip_duration_s": 10.0,
      "player_id": "p01",
      "attribution_source": "COACH",
      "team_side": "OURS",
      "source": "AI",
      "status": "ACTIVE",
      "exclude_reason": null,
      "x_m": 6.2,
      "y_m": 0.0,
      "distance_m": 6.2,
      "behind_three_point_line": false,
      "shot_value": 2,
      "made": true,
      "label_zh": "二分·命中"
    },
    {
      "id": "e02",
      "kind": "SHOT",
      "timestamp_s": 96.0,
      "period": 1,
      "in_bounds": true,
      "confidence": 0.9,
      "clip_key": "clips/e02.mp4",
      "clip_start_s": 91.0,
      "clip_duration_s": 10.0,
      "player_id": "p02",
      "attribution_source": "COACH",
      "team_side": "OURS",
      "source": "AI",
      "status": "ACTIVE",
      "exclude_reason": null,
      "x_m": 1.0,
      "y_m": 6.7,
      "distance_m": 6.774,
      "behind_three_point_line": true,
      "shot_value": 3,
      "made": false,
      "label_zh": "三分·未中"
    },
    {
      "id": "e03",
      "kind": "FAST_BREAK",
      "timestamp_s": 130.0,
      "period": 1,
      "in_bounds": true,
      "confidence": 0.9,
      "clip_key": "clips/e03.mp4",
      "clip_start_s": 125.0,
      "clip_duration_s": 10.0,
      "player_id": "p05",
      "attribution_source": "COACH",
      "team_side": "OURS",
      "source": "AI",
      "status": "ACTIVE",
      "exclude_reason": null,
      "x_m": null,
      "y_m": null,
      "distance_m": null,
      "behind_three_point_line": null,
      "shot_value": null,
      "made": null,
      "label_zh": null
    },
    {
      "id": "e04",
      "kind": "SHOT",
      "timestamp_s": 188.0,
      "period": 1,
      "in_bounds": true,
      "confidence": 0.9,
      "clip_key": "clips/e04.mp4",
      "clip_start_s": 183.0,
      "clip_duration_s": 10.0,
      "player_id": "p03",
      "attribution_source": "COACH",
      "team_side": "OURS",
      "source": "AI",
      "status": "ACTIVE",
      "exclude_reason": null,
      "x_m": 7.0,
      "y_m": 1.0,
      "distance_m": 7.071,
      "behind_three_point_line": true,
      "shot_value": 3,
      "made": true,
      "label_zh": "三分·命中"
    },
    {
      "id": "e05",
      "kind": "SHOT",
      "timestamp_s": 240.0,
      "period": 1,
      "in_bounds": true,
      "confidence": 0.9,
      "clip_key": "clips/e05.mp4",
      "clip_start_s": 235.0,
      "clip_duration_s": 10.0,
      "player_id": null,
      "attribution_source": "NOT_OUR_TEAM",
      "team_side": "OPPONENT",
      "source": "AI",
      "status": "ACTIVE",
      "exclude_reason": null,
      "x_m": 6.8,
      "y_m": 0.2,
      "distance_m": 6.803,
      "behind_three_point_line": true,
      "shot_value": 3,
      "made": true,
      "label_zh": "三分·命中"
    },
    {
      "id": "e06",
      "kind": "SHOT",
      "timestamp_s": 302.0,
      "period": 1,
      "in_bounds": true,
      "confidence": 0.9,
      "clip_key": "clips/e06.mp4",
      "clip_start_s": 297.0,
      "clip_duration_s": 10.0,
      "player_id": null,
      "attribution_source": "NOT_OUR_TEAM",
      "team_side": "OPPONENT",
      "source": "AI",
      "status": "ACTIVE",
      "exclude_reason": null,
      "x_m": 3.0,
      "y_m": 3.0,
      "distance_m": 4.243,
      "behind_three_point_line": false,
      "shot_value": 2,
      "made": false,
      "label_zh": "二分·未中"
    },
    {
      "id": "e07",
      "kind": "TURNOVER",
      "timestamp_s": 340.0,
      "period": 1,
      "in_bounds": true,
      "confidence": 0.9,
      "clip_key": "clips/e07.mp4",
      "clip_start_s": 335.0,
      "clip_duration_s": 10.0,
      "player_id": "p04",
      "attribution_source": "COACH",
      "team_side": "OURS",
      "source": "AI",
      "status": "ACTIVE",
      "exclude_reason": null,
      "x_m": null,
      "y_m": null,
      "distance_m": null,
      "behind_three_point_line": null,
      "shot_value": null,
      "made": null,
      "label_zh": null
    },
    {
      "id": "e08",
      "kind": "SHOT",
      "timestamp_s": 508.0,
      "period": 2,
      "in_bounds": true,
      "confidence": 0.9,
      "clip_key": "clips/e08.mp4",
      "clip_start_s": 503.0,
      "clip_duration_s": 10.0,
      "player_id": "p01",
      "attribution_source": "COACH",
      "team_side": "OURS",
      "source": "AI",
      "status": "ACTIVE",
      "exclude_reason": null,
      "x_m": 4.0,
      "y_m": -1.0,
      "distance_m": 4.123,
      "behind_three_point_line": false,
      "shot_value": 2,
      "made": true,
      "label_zh": "二分·命中"
    },
    {
      "id": "e09",
      "kind": "SHOT",
      "timestamp_s": 602.0,
      "period": 2,
      "in_bounds": true,
      "confidence": 0.9,
      "clip_key": "clips/e09.mp4",
      "clip_start_s": 597.0,
      "clip_duration_s": 10.0,
      "player_id": null,
      "attribution_source": null,
      "team_side": "OURS",
      "source": "AI",
      "status": "ACTIVE",
      "exclude_reason": null,
      "x_m": 7.1,
      "y_m": -2.0,
      "distance_m": 7.376,
      "behind_three_point_line": true,
      "shot_value": 3,
      "made": false,
      "label_zh": "三分·未中"
    },
    {
      "id": "e10",
      "kind": "SHOT",
      "timestamp_s": 660.0,
      "period": 2,
      "in_bounds": true,
      "confidence": 0.9,
      "clip_key": "clips/e10.mp4",
      "clip_start_s": 655.0,
      "clip_duration_s": 10.0,
      "player_id": "p02",
      "attribution_source": "COACH",
      "team_side": "OURS",
      "source": "AI",
      "status": "ACTIVE",
      "exclude_reason": null,
      "x_m": 6.9,
      "y_m": 0.0,
      "distance_m": 6.9,
      "behind_three_point_line": true,
      "shot_value": 3,
      "made": false,
      "label_zh": "三分·未中"
    },
    {
      "id": "e11",
      "kind": "SHOT",
      "timestamp_s": 712.0,
      "period": 2,
      "in_bounds": true,
      "confidence": 0.9,
      "clip_key": "clips/e11.mp4",
      "clip_start_s": 707.0,
      "clip_duration_s": 10.0,
      "player_id": null,
      "attribution_source": "UNKNOWN",
      "team_side": "UNKNOWN",
      "source": "AI",
      "status": "ACTIVE",
      "exclude_reason": null,
      "x_m": 3.0,
      "y_m": 3.0,
      "distance_m": 4.243,
      "behind_three_point_line": false,
      "shot_value": 2,
      "made": true,
      "label_zh": "二分·命中"
    },
    {
      "id": "e12",
      "kind": "SHOT",
      "timestamp_s": 735.0,
      "period": 2,
      "in_bounds": true,
      "confidence": 0.9,
      "clip_key": "clips/e12.mp4",
      "clip_start_s": 730.0,
      "clip_duration_s": 10.0,
      "player_id": null,
      "attribution_source": null,
      "team_side": "OURS",
      "source": "COACH",
      "status": "EXCLUDED",
      "exclude_reason": "误检：实为传球出界",
      "x_m": 7.1,
      "y_m": -2.0,
      "distance_m": 7.376,
      "behind_three_point_line": true,
      "shot_value": 3,
      "made": false,
      "label_zh": "三分·未中"
    }
  ],
  "formations": [
    {
      "timestamp_s": 120.0,
      "period": 1,
      "positions_m": [
        [
          5.6,
          0.0
        ],
        [
          4.2,
          -5.2
        ],
        [
          4.2,
          5.2
        ],
        [
          1.9,
          -2.4
        ],
        [
          1.9,
          2.4
        ]
      ],
      "ball_m": [
        5.6,
        0.0
      ],
      "label": null,
      "confidence": 0.47
    }
  ],
  "periods": [
    {
      "index": 1,
      "start_s": 0.0,
      "end_s": 480.0,
      "attacking_basket": "LEFT"
    },
    {
      "index": 2,
      "start_s": 480.0,
      "end_s": 960.0,
      "attacking_basket": "RIGHT"
    },
    {
      "index": 3,
      "start_s": 960.0,
      "end_s": 1440.0,
      "attacking_basket": "LEFT"
    },
    {
      "index": 4,
      "start_s": 1440.0,
      "end_s": 1920.0,
      "attacking_basket": "RIGHT"
    }
  ],
  "team_stats": {
    "shots_made": 3,
    "shots_attempted": 6,
    "arc_out_made": 1,
    "arc_out_attempted": 4,
    "turnovers": 1,
    "points": 7,
    "fast_breaks": 1,
    "possessions": 11
  },
  "opponent_stats": {
    "shots_made": 1,
    "shots_attempted": 2,
    "arc_out_made": 1,
    "arc_out_attempted": 1,
    "turnovers": 0,
    "points": 3
  },
  "coverage": {
    "events_total": 12,
    "events_attributed": 7,
    "events_excluded": 1,
    "events_side_unknown": 1
  },
  "warnings": [
    "示例数据：由 mock pipeline 生成，坐标与分值真实计算，事件本身为模拟"
  ]
}
